<?xml version="1.1" encoding="UTF-8"?>
<!DOCTYPE building SYSTEM "building.dtd">
<building worker="WINEGROWER" workradius="4">
	<ground groundtype="GRASS"/>
	<ground groundtype="EARTH"/>
	<ground groundtype="FLATTENED"/>
	
 	<blocked dx="-3" dy="0" block="true" />
	<blocked dx="-3" dy="-1" block="true" />
	<blocked dx="-2" dy="-2" block="true" />
	<blocked dx="-3" dy="-3" block="true" />
	<blocked dx="-1" dy="-3" block="true" />
	<blocked dx="1" dy="-1" block="true" />
	<blocked dx="2" dy="1" block="true" />
	<blocked dx="2" dy="2" block="true" />
	<blocked dx="1" dy="0" block="true" />
	<blocked dx="1" dy="1" block="true" />
	<blocked dx="1" dy="2" block="true" />
	<blocked dx="0" dy="-2" block="true" />
	<blocked dx="0" dy="-1" block="true" />
	<blocked dx="0" dy="0" block="true" />
	<blocked dx="0" dy="1" block="true" />
	<blocked dx="0" dy="2" block="true" />
	<blocked dx="-1" dy="-2" block="true" />
	<blocked dx="-1" dy="-1" block="true" />
	<blocked dx="-1" dy="0" block="true" />
	<blocked dx="-1" dy="1" block="true" />
	<blocked dx="-2" dy="-1" block="true" />
	<blocked dx="-2" dy="0" block="true" />
	<blocked dx="-2" dy="1" block="true" />
	<blocked dx="-2" dy="-3" block="true" />
	<blocked dx="2" dy="0" block="true" />
	<blocked dx="0" dy="3" block="true" />
	<blocked dx="-3" dy="-2" block="true" />
	<blocked dx="-1" dy="2" block="false" />
	<blocked dx="2" dy="4" block="false" />
	<blocked dx="1" dy="-2" block="false" />
	<blocked dx="1" dy="3" block="false" />
	<blocked dx="2" dy="3" block="false" />
	<blocked dx="3" dy="3" block="false" />
	<blocked dx="3" dy="2" block="false" />
	<blocked dx="3" dy="1" block="false" />
	<blocked dx="2" dy="-1" block="false" />
	<blocked dx="3" dy="0" block="false" />
	<blocked dx="3" dy="4" block="false" />
	<blocked dx="0" dy="4" block="false" />
	<blocked dx="-1" dy="3" block="false" />
	<blocked dx="-2" dy="2" block="false" />
	<blocked dx="-3" dy="1" block="false" />
	<blocked dx="-4" dy="0" block="false" />
	<blocked dx="-4" dy="-1" block="false" />
	<blocked dx="-4" dy="-2" block="false" />
	<blocked dx="-4" dy="-3" block="false" />
	<blocked dx="-4" dy="-4" block="false" />
	<blocked dx="-3" dy="-4" block="false" />
	<blocked dx="-2" dy="-4" block="false" />
	<blocked dx="-1" dy="-4" block="false" />
	<blocked dx="0" dy="-3" block="false" />
	<blocked dx="1" dy="4" block="false" />
	
	<door dx="-1" dy="2" />
	
    <!-- materials checked with original -->
	<stack dx="0" dy="4" material="PLANK" buildrequired="4" />
	<stack dx="2" dy="4" material="STONE" buildrequired="4" />
	
	<bricklayer dx="2" dy="3" direction="NORTH_WEST" />
	<bricklayer dx="3" dy="2" direction="NORTH_WEST" />
	<bricklayer dx="-3" dy="1" direction="NORTH_EAST" />
	<bricklayer dx="-1" dy="3" direction="NORTH_EAST" />
	
	<flag dx="-1" dy="0" />
	
	<buildmark dx="-3" dy="0" />
	<buildmark dx="0" dy="3" />
	<buildmark dx="2" dy="2" />
	<buildmark dx="2" dy="0" />
	<buildmark dx="-1" dy="-3" />
	<buildmark dx="-3" dy="-3" />

	<workcenter dx="3" dy="9"/>

	<image file="14" for="GUI" type="GUI" sequence="90" image="0"/>
    <image file="13" type="SETTLER" for="FINAL" image="0" sequence="33"/>
    <image file="13" type="SETTLER" for="BUILD" image="1" sequence="33"/>
	
	<startjob name="gohome"/>	
	
	<!-- going home job -->
	<job name="gohome" 			type="GO_TO" 			successjob="hide" 			failjob="hide" 		dx="-1" dy="2"/>
	<job name="hide" 			type="HIDE" 			successjob="start" 			failjob="start"			/>
	
	<job name="start" 			type="WAIT" 			successjob="check" 			failjob="check" 		time="8.0"/>
    <job name="check"			type="NOT_FULL"			successjob="presearch1"		failjob="presearch2"	dx="3" dy="4" material="WINE"/>
    
	<job name="presearch1" 		type="PRE_SEARCH" 		successjob="goHarvesting1" 	failjob="presearch2" 	search="HARVESTABLE_WINE"/>
	<job name="presearch2" 		type="PRE_SEARCH" 		successjob="goPlanting1"	failjob="start" 		search="PLANTABLE_WINE"/>
        
    <!-- 1: harvest some wine -->
    <job name="goHarvesting1"	type="SET_MATERIAL"		successjob="goHarvesting2"	failjob="gohome"		material="BASKET"/>
    <job name="goHarvesting2"	type="SHOW"				successjob="search1"		failjob="start"			dx="-1" dy="4" direction="SOUTH_WEST"/>
    <job name="search1"  		type="FOLLOW_SEARCHED"	successjob="cutlook_at_NE"	failjob="hide"			/>
   
    <job name="cutlook_at_NE"	type="LOOK_AT"			successjob="cut1"			failjob="gohome"		direction="NORTH_EAST"/>
    <job name="cut1"			type="PLAY_ACTION1"		successjob="cutlook_at_SW"	failjob="gohome"		time="1.0"/>
    <job name="cutlook_at_SW"	type="LOOK_AT"			successjob="cut2"			failjob="gohome"		direction="SOUTH_WEST"/>
    <job name="cut2"			type="PLAY_ACTION1"		successjob="cutlook_at_W"	failjob="gohome"		time="1.0"/>
    <job name="cutlook_at_W" 	type="LOOK_AT"			successjob="cut3"			failjob="gohome"		direction="WEST"/>
    <job name="cut3"			type="PLAY_ACTION1"		successjob="cutlook_at_NW"	failjob="gohome"		time="1.0"/>
    <job name="cutlook_at_NW" 	type="LOOK_AT"			successjob="cut4"			failjob="gohome"		direction="NORTH_WEST"/>
    <job name="cut4"			type="PLAY_ACTION1"		successjob="execute1"		failjob="gohome"		time="1.0"/>
    
    <job name="execute1"		type="EXECUTE"			successjob="look_at"		failjob="gohome"		search="HARVESTABLE_WINE"/>
    <job name="look_at"			type="LOOK_AT"			successjob="take"			failjob="gohome"		direction="NORTH_EAST"/>
    <job name="take" 			type="TAKE" 			successjob="changeMat2" 	failjob="gohome"		material="WINE"/>
	<job name="changeMat2"	 	type="SET_MATERIAL" 	successjob="goback" 		failjob="gohome" 		material="WINE"/>
	<job name="goback" 			type="GO_TO" 			successjob="produceWine1" 	failjob="produceWine1"	dx="-1" dy="2"/>
	
	<job name="produceWine1"	type="HIDE" 			successjob="produceWine2" 	failjob="hide" 			/>
	<job name="produceWine2"	type="WAIT" 			successjob="produceWine3" 	failjob="hide" 			time="3.0"/>
	<job name="produceWine3"	type="SHOW" 			successjob="goToDrop"		failjob="hide" 			dx="-1" dy="4" direction="SOUTH_WEST"/>
	
	<job name="goToDrop"		type="GO_TO" 			successjob="look"			failjob="hide" 			dx="3" dy="4"/>
	<job name="look"			type="LOOK_AT"			successjob="drop"			failjob="hide"			direction="NORTH_EAST"/>
	<job name="drop" 			type="DROP" 			successjob="changeMat" 		failjob="hide" 			material="WINE"/>
	<job name="changeMat" 		type="SET_MATERIAL"		successjob="gohome" 		failjob="hide" 			material="NO_MATERIAL"/>
	
     <!-- 2: plant a new corn -->
    <job name="goPlanting1"		type="SET_MATERIAL"		successjob="goPlantingShow"	failjob="gohome"		material="PLANT"/>
    <job name="goPlantingShow"	type="SHOW"				successjob="search2"		failjob="hide"			dx="-1" dy="4" direction="SOUTH_WEST"/>
    <job name="search2"			type="FOLLOW_SEARCHED"	successjob="seedlook_at_NE"	failjob="gohome"		/>
    <job name="seedlook_at_NE"	type="LOOK_AT"			successjob="seed1"			failjob="gohome"		direction="NORTH_EAST"/>
    <job name="seed1"			type="PLAY_ACTION2"		successjob="seedlook_at_SE"	failjob="gohome"		time="1.4"/>
	<job name="seedlook_at_SE"	type="LOOK_AT"			successjob="seed2"			failjob="gohome"		direction="SOUTH_EAST"/>
    <job name="seed2"			type="PLAY_ACTION2"		successjob="seedlook_at_SW"	failjob="gohome"		time="1.4"/>
	<job name="seedlook_at_SW"	type="LOOK_AT"			successjob="seed3"			failjob="gohome"		direction="SOUTH_WEST"/>
    <job name="seed3"			type="PLAY_ACTION2"		successjob="seedlook_at_NW"	failjob="gohome"		time="1.4"/>
	<job name="seedlook_at_NW"	type="LOOK_AT"			successjob="seed4"			failjob="gohome"		direction="NORTH_WEST"/>
    <job name="seed4"			type="PLAY_ACTION2"		successjob="execute2"		failjob="gohome"		time="1.4"/>
	<job name="execute2"		type="EXECUTE"			successjob="no_mat2"		failjob="gohome"		search="PLANTABLE_WINE"/>
 	<job name="no_mat2" 		type="SET_MATERIAL"		successjob="gohome" 		failjob="gohome" 		material="NO_MATERIAL"/>
 	
 </building>