<?xml version="1.0" encoding="UTF-8"?>
<!DOCTYPE building SYSTEM "building.dtd">
<building worker="MINER" workradius="0">
	<ground groundtype="MOUNTAIN" />

	<blocked dx="-2" dy="0" block="true" />
	<blocked dx="-2" dy="-1" block="true" />
	<blocked dx="-2" dy="-2" block="true" />
	<blocked dx="-1" dy="1" block="true" />
	<blocked dx="-1" dy="0" block="true" />
	<blocked dx="-1" dy="-2" block="true" />
	<blocked dx="-1" dy="-3" block="true" />
	<blocked dx="0" dy="-2" block="true" />
	<blocked dx="0" dy="-1" block="true" />
	<blocked dx="0" dy="0" block="true" />
	<blocked dx="0" dy="1" block="true" />
	<blocked dx="0" dy="2" block="true" />
	<blocked dx="1" dy="3" block="true" />
	<blocked dx="1" dy="2" block="true" />
	<blocked dx="1" dy="1" block="true" />
	<blocked dx="1" dy="0" block="true" />
	<blocked dx="1" dy="-1" block="true" />
	<blocked dx="2" dy="0" block="true" />
	<blocked dx="2" dy="1" block="true" />
	<blocked dx="-2" dy="1" block="true" />
	<blocked dx="3" dy="2" block="false" />
	<blocked dx="3" dy="3" block="false" />
	<blocked dx="2" dy="2" block="false" />
	<blocked dx="2" dy="3" block="false" />
	<blocked dx="2" dy="4" block="false" />
	<blocked dx="1" dy="4" block="false" />
	<blocked dx="0" dy="3" block="false" />
	<blocked dx="-1" dy="2" block="false" />
	<blocked dx="-3" dy="0" block="false" />
	<blocked dx="-3" dy="-1" block="false" />
	<blocked dx="-3" dy="-2" block="false" />
	<blocked dx="-3" dy="-3" block="false" />
	<blocked dx="-2" dy="-3" block="false" />
	<blocked dx="-2" dy="-4" block="false" />
	<blocked dx="-1" dy="-4" block="false" />
	<blocked dx="0" dy="-3" block="false" />
	<blocked dx="1" dy="-2" block="false" />
	<blocked dx="2" dy="-1" block="false" />
	<blocked dx="3" dy="0" block="false" />
	<blocked dx="3" dy="1" block="false" />
	<blocked dx="4" dy="1" block="false" />
	<blocked dx="4" dy="2" block="false" />
	<blocked dx="4" dy="3" block="false" />
	<blocked dx="-3" dy="1" block="false" />
	<blocked dx="-2" dy="2" block="false" />
	<blocked dx="-1" dy="3" block="false" />
	<blocked dx="0" dy="4" block="false" />
	<door dx="-1" dy="2" />
	<stack dx="0" dy="4" material="PLANK" buildrequired="3" />
	<stack dx="2" dy="4" material="STONE" buildrequired="1" />
	<bricklayer dx="-2" dy="2" direction="NORTH_EAST" />
	<bricklayer dx="0" dy="3" direction="NORTH_EAST" />
	<bricklayer dx="2" dy="3" direction="NORTH_WEST" />
	<bricklayer dx="3" dy="2" direction="NORTH_WEST" />
	<flag dx="-1" dy="0" />
	<buildmark dx="1" dy="3" />
	<buildmark dx="2" dy="0" />
	<buildmark dx="-1" dy="-3" />
	<buildmark dx="-2" dy="1" />
	<buildmark dx="-2" dy="-2" />
</building>