<?xml version="1.1" encoding="UTF-8"?><!DOCTYPE building SYSTEM "building.dtd">
<building worker="">
	<ground groundtype="GRASS"/>
	<ground groundtype="EARTH"/>
	<ground groundtype="FLATTENED"/>

	<blocked dx="4" dy="3" />
	<blocked dx="3" dy="2" />
	<blocked dx="3" dy="3" />
	<blocked dx="3" dy="4" />
	<blocked dx="2" dy="4" />
	<blocked dx="1" dy="3" />
	<blocked dx="1" dy="2" />
	<blocked dx="2" dy="3" />
	<blocked dx="2" dy="2" />
	<blocked dx="2" dy="1" />
	<blocked dx="1" dy="1" />
	<blocked dx="1" dy="0" />
	<blocked dx="2" dy="-1" />
	<blocked dx="3" dy="0" />
	<blocked dx="4" dy="2" />
	<blocked dx="5" dy="2" />
	<blocked dx="5" dy="3" />
	<blocked dx="5" dy="1" />
	<blocked dx="5" dy="0" />
	<blocked dx="4" dy="0" />
	<blocked dx="3" dy="-1" />
	<blocked dx="4" dy="-1" />
	<blocked dx="2" dy="-2" />
	<blocked dx="1" dy="-3" />
	<blocked dx="-1" dy="2" />
	<blocked dx="-1" dy="1" />
	<blocked dx="-1" dy="0" />
	<blocked dx="-1" dy="-1" />
	<blocked dx="-1" dy="-2" />
	<blocked dx="-1" dy="-3" />
	<blocked dx="-1" dy="-4" />
	<blocked dx="-2" dy="-3" />
	<blocked dx="-2" dy="-4" />
	<blocked dx="0" dy="-3" />
	<blocked dx="1" dy="-2" />
	<blocked dx="1" dy="-1" />
	<blocked dx="3" dy="-2" />
	<blocked dx="2" dy="-3" />
	<blocked dx="1" dy="-4" />
	<blocked dx="0" dy="-4" />
	<blocked dx="-1" dy="-5" />
	<blocked dx="-2" dy="-6" />
	<blocked dx="-2" dy="-5" />
	<blocked dx="0" dy="-2" />
	<blocked dx="0" dy="-1" />
	<blocked dx="0" dy="0" />
	<blocked dx="0" dy="1" />
	<door dx="0" dy="2" />
	<stack dx="6" dy="6" material="PLANK" buildrequired="5" />
	<stack dx="7" dy="4" material="STONE" buildrequired="8" />

	<bricklayer dx="-1" dy="3" direction="NORTH_EAST"/>
	<bricklayer dx="2" dy="5" direction="NORTH_EAST"/>
	<bricklayer dx="4" dy="4" direction="NORTH_WEST"/>
	<bricklayer dx="6" dy="4" direction="NORTH_WEST"/>
	<bricklayer dx="6" dy="2" direction="NORTH_WEST"/>

	<flag dx="-2" dy="3" />
	
	<image file="14" for="GUI" type="GUI" sequence="75" image="0"/>
	</building>