<?xml version="1.0" encoding="UTF-8"?>
<!DOCTYPE building SYSTEM "building.dtd" >
<building worker="SLAUGHTERER">
	<ground groundtype="GRASS" />
	<ground groundtype="EARTH" />
	<ground groundtype="FLATTENED" />
	
		<blocked dx="-3" dy="0" block="true" />
	<blocked dx="-3" dy="-1" block="true" />
	<blocked dx="-3" dy="-2" block="true" />
	<blocked dx="-3" dy="-3" block="true" />
	<blocked dx="-2" dy="-3" block="true" />
	<blocked dx="-1" dy="-3" block="true" />
	<blocked dx="0" dy="-2" block="true" />
	<blocked dx="1" dy="-1" block="true" />
	<blocked dx="-2" dy="-4" block="true" />
	<blocked dx="-3" dy="-4" block="true" />
	<blocked dx="-1" dy="-2" block="true" />
	<blocked dx="0" dy="-1" block="true" />
	<blocked dx="1" dy="0" block="true" />
	<blocked dx="0" dy="0" block="true" />
	<blocked dx="1" dy="1" block="true" />
	<blocked dx="-1" dy="-1" block="true" />
	<blocked dx="-2" dy="-2" block="true" />
	<blocked dx="-2" dy="-1" block="true" />
	<blocked dx="-1" dy="0" block="true" />
	<blocked dx="0" dy="1" block="true" />
	<blocked dx="1" dy="2" block="true" />
	<blocked dx="-2" dy="0" block="true" />
	<blocked dx="-1" dy="1" block="true" />
	<blocked dx="0" dy="2" block="true" />
	<blocked dx="1" dy="3" block="true" />
	<blocked dx="-2" dy="1" block="true" />
	<blocked dx="0" dy="3" block="true" />
	<blocked dx="2" dy="0" block="true" />
	<blocked dx="2" dy="1" block="true" />
	<blocked dx="2" dy="2" block="true" />
	<blocked dx="2" dy="3" block="true" />
	<blocked dx="2" dy="4" block="true" />
	<blocked dx="3" dy="3" block="true" />
	<blocked dx="3" dy="2" block="true" />
	<blocked dx="3" dy="1" block="true" />
	<blocked dx="4" dy="2" block="true" />
	<blocked dx="4" dy="1" block="true" />
	<blocked dx="5" dy="2" block="true" />
	<blocked dx="6" dy="3" block="true" />
	<blocked dx="6" dy="4" block="true" />
	<blocked dx="7" dy="5" block="true" />
	<blocked dx="7" dy="4" block="true" />
	<blocked dx="7" dy="6" block="true" />
	<blocked dx="5" dy="3" block="true" />
	<blocked dx="-2" dy="2" block="false" />
	<blocked dx="-1" dy="3" block="false" />
	<blocked dx="0" dy="4" block="false" />
	<blocked dx="1" dy="4" block="false" />
	<blocked dx="-3" dy="1" block="false" />
	<blocked dx="-4" dy="0" block="false" />
	<blocked dx="-4" dy="-1" block="false" />
	<blocked dx="-4" dy="-2" block="false" />
	<blocked dx="-4" dy="-3" block="false" />
	<blocked dx="-4" dy="-4" block="false" />
	<blocked dx="-4" dy="-5" block="false" />
	<blocked dx="-3" dy="-5" block="false" />
	<blocked dx="-2" dy="-5" block="false" />
	<blocked dx="-1" dy="-4" block="false" />
	<blocked dx="0" dy="-3" block="false" />
	<blocked dx="1" dy="-2" block="false" />
	<blocked dx="2" dy="-1" block="false" />
	<blocked dx="6" dy="6" block="false" />
	<blocked dx="6" dy="5" block="false" />
	<blocked dx="5" dy="4" block="false" />
	<blocked dx="4" dy="3" block="false" />
	<blocked dx="4" dy="4" block="false" />
	<blocked dx="5" dy="5" block="false" />
	<blocked dx="3" dy="4" block="false" />
	<blocked dx="2" dy="5" block="false" />
	<blocked dx="3" dy="5" block="false" />
	<blocked dx="4" dy="5" block="false" />
	<blocked dx="1" dy="5" block="false" />
	<blocked dx="-4" dy="1" block="false" />
	<blocked dx="-3" dy="2" block="false" />
	<blocked dx="-2" dy="3" block="false" />
	<blocked dx="-1" dy="4" block="false" />
	<blocked dx="3" dy="0" block="false" />
	<blocked dx="4" dy="0" block="false" />
	<blocked dx="5" dy="1" block="false" />
	<blocked dx="6" dy="2" block="false" />
	<blocked dx="7" dy="3" block="false" />
	<blocked dx="8" dy="5" block="false" />
	<blocked dx="8" dy="6" block="false" />
	<blocked dx="8" dy="7" block="false" />
	<blocked dx="7" dy="7" block="false" />
	<blocked dx="-1" dy="2" block="false" />
	<door dx="-1" dy="2" />
	<stack dx="2" dy="5" material="PLANK" buildrequired="1" />
	<stack dx="4" dy="5" material="STONE" buildrequired="1" />
	<stack dx="-3" dy="2" material="PIG" buildrequired="0" />
	<bricklayer dx="-3" dy="1" direction="NORTH_EAST" />
	<bricklayer dx="0" dy="4" direction="NORTH_EAST" />
	<bricklayer dx="3" dy="4" direction="NORTH_WEST" />
	<bricklayer dx="4" dy="3" direction="NORTH_WEST" />
	<flag dx="-4" dy="-5" />
	<buildmark dx="-3" dy="0" />
	<buildmark dx="0" dy="3" />
	<buildmark dx="3" dy="1" />
	<buildmark dx="3" dy="3" />
	<buildmark dx="-2" dy="-4" />
	<buildmark dx="7" dy="6" />
	<buildmark dx="5" dy="2" />
	
	<image file="14" for="GUI" type="GUI" sequence="39" image="0"/>
	<image file="13" for="FINAL" type="SETTLER" sequence="23" image="0"/>
	<image file="13" for="BUILD" type="SETTLER" sequence="23" image="1"/>

	<!-- drop stack for meat: 1, 4 -->

</building>
	